{
  "$schema": "https://json-schema.org/draft/2020-12/schema",
  "$id": "release-manifest.schema.json",
  "title": "Approved static release manifest",
  "type": "object",
  "additionalProperties": false,
  "required": ["schema_version", "analysis_release_id", "cutoff_exclusive", "approved_at", "source_interface", "source_review_count", "source_hash_mismatches", "files"],
  "properties": {
    "schema_version": {"type": "string", "const": "1.0"},
    "analysis_release_id": {"type": "string"},
    "cutoff_exclusive": {"type": "string"},
    "approved_at": {"type": "string"},
    "source_interface": {"type": "string"},
    "source_review_count": {"type": "integer", "minimum": 1},
    "source_hash_mismatches": {"type": "integer", "const": 0},
    "files": {
      "type": "array",
      "minItems": 1,
      "items": {
        "type": "object",
        "additionalProperties": false,
        "required": ["path", "sha256"],
        "properties": {
          "path": {"type": "string"},
          "sha256": {"type": "string", "pattern": "^[a-f0-9]{64}$"}
        }
      }
    }
  }
}
