{
  "schema_version": "1.0",
  "analysis_release_id": "reliable_20260829_v2",
  "cutoff_exclusive": "2026-08-30T00:00:00+00:00",
  "approved_at": "2026-08-31T00:00:00+00:00",
  "source_interface": "reliable_v2_analysis_base",
  "source_review_count": 924,
  "source_hash_mismatches": 0,
  "files": [
    {"path": "static-content.json", "sha256": "bbbbbbbbbbbbbbbbbbbbbbbbbbbbbbbbbbbbbbbbbbbbbbbbbbbbbbbbbbbbbbbb"}
  ]
}
